{"$schema":"https://json-schema.org/draft/2020-12/schema","$id":"https://aurora-atoms.github.io/lattice/schemas/capability/adversarial-innovation-handoff.v1.schema.json","title":"Adversarial Innovation Handoff v1","type":"object","additionalProperties":false,"required":["$schema","contract","handoff_id","revision","scope","source_review","mechanism_candidates","evidence","simulation_status"],"properties":{"$schema":{"const":"schemas/capability/adversarial-innovation-handoff.v1.schema.json"},"contract":{"const":"lat.adversarial-innovation-handoff.v1"},"handoff_id":{"$ref":"#/$defs/id"},"revision":{"type":"integer","minimum":1},"scope":{"$ref":"#/$defs/scope"},"source_review":{"$ref":"#/$defs/source_review"},"mechanism_candidates":{"type":"array","minItems":1,"items":{"$ref":"#/$defs/mechanism_candidate"}},"evidence":{"$ref":"#/$defs/evidence_ledger"},"simulation_status":{"enum":["synthetic_reference","public_research"]}},"$defs":{"id":{"type":"string","minLength":1,"pattern":"^[A-Za-z0-9][A-Za-z0-9._:-]*$"},"non_empty_string":{"type":"string","minLength":1},"source_ref":{"type":"string","minLength":1,"pattern":"^[A-Za-z][A-Za-z0-9+.-]*:.+"},"unique_non_empty_strings":{"type":"array","uniqueItems":true,"items":{"$ref":"#/$defs/non_empty_string"}},"source_refs":{"type":"array","uniqueItems":true,"items":{"$ref":"#/$defs/source_ref"}},"evidence_status":{"enum":["OBSERVED","DERIVED","JUDGED","UNKNOWN"]},"scope":{"type":"object","additionalProperties":false,"required":["case_ref","topic","public_only","customer_segment","consequential_action","evidence_cutoff","excluded_uses"],"properties":{"case_ref":{"$ref":"#/$defs/source_ref"},"topic":{"$ref":"#/$defs/non_empty_string"},"public_only":{"const":true},"customer_segment":{"$ref":"#/$defs/non_empty_string"},"consequential_action":{"$ref":"#/$defs/non_empty_string"},"evidence_cutoff":{"type":"string","format":"date-time"},"excluded_uses":{"$ref":"#/$defs/unique_non_empty_strings"}}},"source_review":{"type":"object","additionalProperties":false,"required":["review_contract","review_ref","review_id","source_chain_ids","replay_refs"],"properties":{"review_contract":{"enum":["lat.safety-critical-review.v1","equivalent-public-review"]},"review_ref":{"$ref":"#/$defs/source_ref"},"review_id":{"$ref":"#/$defs/id"},"source_chain_ids":{"allOf":[{"$ref":"#/$defs/unique_non_empty_strings"},{"minItems":1}]},"replay_refs":{"type":"array","minItems":1,"uniqueItems":true,"items":{"$ref":"#/$defs/source_ref"}}}},"hard_case":{"type":"object","additionalProperties":false,"required":["trigger","locally_correct_components","wrong_world_outcome","reproducibility","replay_ref","evidence_status"],"properties":{"trigger":{"$ref":"#/$defs/non_empty_string"},"locally_correct_components":{"allOf":[{"$ref":"#/$defs/unique_non_empty_strings"},{"minItems":1}]},"wrong_world_outcome":{"$ref":"#/$defs/non_empty_string"},"reproducibility":{"enum":["deterministic","intermittent","not_reproduced","unknown"]},"replay_ref":{"$ref":"#/$defs/source_ref"},"evidence_status":{"$ref":"#/$defs/evidence_status"}}},"missing_mechanism":{"type":"object","additionalProperties":false,"required":["technical_problem","mechanism_statement","enforcement_boundary","state_identity_contract","observable_effect","generalization_scope","non_goals"],"properties":{"technical_problem":{"$ref":"#/$defs/non_empty_string"},"mechanism_statement":{"$ref":"#/$defs/non_empty_string"},"enforcement_boundary":{"$ref":"#/$defs/non_empty_string"},"state_identity_contract":{"$ref":"#/$defs/non_empty_string"},"observable_effect":{"$ref":"#/$defs/non_empty_string"},"generalization_scope":{"$ref":"#/$defs/non_empty_string"},"non_goals":{"$ref":"#/$defs/unique_non_empty_strings"}}},"commercial_value":{"type":"object","additionalProperties":false,"required":["customer","pain","measurable_outcome","monetization_or_attach_point","adoption_reason"],"properties":{"customer":{"$ref":"#/$defs/non_empty_string"},"pain":{"$ref":"#/$defs/non_empty_string"},"measurable_outcome":{"$ref":"#/$defs/non_empty_string"},"monetization_or_attach_point":{"$ref":"#/$defs/non_empty_string"},"adoption_reason":{"$ref":"#/$defs/non_empty_string"}}},"counter_control":{"type":"object","additionalProperties":false,"required":["strongest_control","source_refs","evidence_status","defeats_candidate","rationale"],"properties":{"strongest_control":{"$ref":"#/$defs/non_empty_string"},"source_refs":{"$ref":"#/$defs/source_refs"},"evidence_status":{"$ref":"#/$defs/evidence_status"},"defeats_candidate":{"type":"boolean"},"rationale":{"$ref":"#/$defs/non_empty_string"}}},"falsifier":{"type":"object","additionalProperties":false,"required":["falsifier_id","statement","method","status","source_refs"],"properties":{"falsifier_id":{"$ref":"#/$defs/id"},"statement":{"$ref":"#/$defs/non_empty_string"},"method":{"$ref":"#/$defs/non_empty_string"},"status":{"enum":["open","survived","failed","unknown"]},"source_refs":{"$ref":"#/$defs/source_refs"}}},"prior_art_challenge":{"type":"object","additionalProperties":false,"required":["workflow_ref","status","coverage_refs","strongest_counterevidence","conclusion"],"properties":{"workflow_ref":{"$ref":"#/$defs/source_ref"},"status":{"enum":["not_started","pending","completed","blocked"]},"coverage_refs":{"$ref":"#/$defs/source_refs"},"strongest_counterevidence":{"$ref":"#/$defs/non_empty_string"},"conclusion":{"enum":["not_run","no_equivalent_found_in_bounded_search","equivalent_or_broader_mechanism_found","insufficient_coverage"]}}},"mechanism_candidate":{"type":"object","additionalProperties":false,"required":["candidate_id","source_chain_ids","load_bearing_invariant","hard_case","missing_mechanism","commercial_value","counter_control","falsifiers","prior_art_challenge","status","decision","rationale","next_falsification_step"],"properties":{"candidate_id":{"$ref":"#/$defs/id"},"source_chain_ids":{"allOf":[{"$ref":"#/$defs/unique_non_empty_strings"},{"minItems":1}]},"load_bearing_invariant":{"$ref":"#/$defs/non_empty_string"},"hard_case":{"$ref":"#/$defs/hard_case"},"missing_mechanism":{"$ref":"#/$defs/missing_mechanism"},"commercial_value":{"$ref":"#/$defs/commercial_value"},"counter_control":{"$ref":"#/$defs/counter_control"},"falsifiers":{"type":"array","minItems":1,"items":{"$ref":"#/$defs/falsifier"}},"prior_art_challenge":{"$ref":"#/$defs/prior_art_challenge"},"status":{"enum":["candidate","prior_art_pending","challenged","retain_candidate","reject_existing_control","reject_prior_art","reject_not_reproducible","reject_not_commercial","insufficient_evidence"]},"decision":{"enum":["needs_more_evidence","retain_for_research","reject"]},"rationale":{"$ref":"#/$defs/non_empty_string"},"next_falsification_step":{"$ref":"#/$defs/non_empty_string"}}},"evidence_item":{"type":"object","additionalProperties":false,"required":["statement","evidence_status","source_refs"],"properties":{"statement":{"$ref":"#/$defs/non_empty_string"},"evidence_status":{"$ref":"#/$defs/evidence_status"},"source_refs":{"$ref":"#/$defs/source_refs"}}},"evidence_ledger":{"type":"object","additionalProperties":false,"required":["claims","unknowns"],"properties":{"claims":{"type":"array","items":{"$ref":"#/$defs/evidence_item"}},"unknowns":{"type":"array","items":{"$ref":"#/$defs/evidence_item"}}}}}}