{"$schema":"schemas/capability/adversarial-innovation-handoff.v1.schema.json","contract":"lat.adversarial-innovation-handoff.v1","handoff_id":"AIH-SYN-001","revision":1,"scope":{"case_ref":"synthetic://feature-delivery-case/target-binding-001","topic":"Version-bound physical-target execution across asynchronous node handoff","public_only":true,"customer_segment":"Operators of multi-node cyber-physical action systems","consequential_action":"Dispatch one simulated action to one approved physical-target lineage","evidence_cutoff":"2026-08-24T14:00:00Z","excluded_uses":["live targeting","real actuator control","legal patentability opinion","confidential product analysis"]},"source_review":{"review_contract":"lat.safety-critical-review.v1","review_ref":"synthetic://safety-review/SCR-SYN-001","review_id":"SCR-SYN-001","source_chain_ids":["CHAIN-SYN-001"],"replay_refs":["synthetic://replay-fixtures/target-binding-l4-001"]},"mechanism_candidates":[{"candidate_id":"MECH-SYN-001","source_chain_ids":["CHAIN-SYN-001"],"load_bearing_invariant":"The approved physical-target lineage must equal the lineage bound to the node-local execution handle at dispatch.","hard_case":{"trigger":"The selected execution node changes after approval but before dispatch.","locally_correct_components":["the approval references the intended fused target","the handoff creates a valid new node-local handle","the queued command is structurally valid","the actuator accepts the addressed handle"],"wrong_world_outcome":"A stale queued binding can address a different simulated physical target even though each local component remains valid.","reproducibility":"deterministic","replay_ref":"synthetic://replay-fixtures/target-binding-l4-001","evidence_status":"OBSERVED"},"missing_mechanism":{"technical_problem":"Approval identity and node-native execution identity can diverge across asynchronous handoff.","mechanism_statement":"Bind a single-use execution capability to the approved physical-target lineage and binding version, invalidate it on semantic handoff, and require current lineage-to-native-handle verification at the effect boundary before dispatch.","enforcement_boundary":"Deterministic effect broker immediately before actuator dispatch.","state_identity_contract":"The capability carries approved lineage, approved binding version, action scope, and expiry; dispatch compares them with the current verified node-local binding and consumes the capability once.","observable_effect":"A stale or semantically changed binding emits HOLD/REBIND with no actuator dispatch receipt.","generalization_scope":"Cyber-physical systems where approval occurs in one identity domain and actuation uses a node- or vendor-native handle that can change before execution.","non_goals":["generic RBAC","generic audit logging","generic retry handling","claiming a legal patent conclusion"]},"commercial_value":{"customer":"Organizations operating consequential multi-node or multi-vendor action systems","pain":"A valid operator or policy approval can be applied to the wrong physical resource after a handoff or identity translation change.","measurable_outcome":"Reduce wrong-target dispatches while measuring false-HOLD rate, added dispatch latency, and rebind completion time.","monetization_or_attach_point":"Premium safety-control layer, validated effect broker, or integration feature for high-consequence orchestration products.","adoption_reason":"The mechanism provides machine-enforced target continuity at the execution boundary rather than relying on operator confirmation or post-hoc audit."},"counter_control":{"strongest_control":"Ordinary compare-and-swap on a current state version combined with typed identifiers and normal handoff rebinding.","source_refs":["synthetic://counter-controls/cas-and-rebind"],"evidence_status":"JUDGED","defeats_candidate":false,"rationale":"The synthetic hard case survives when the version check does not bind the approved physical lineage to the current node-native handle and when approval remains transferable across the semantic handoff."},"falsifiers":[{"falsifier_id":"KILL-SYN-001","statement":"A competent baseline using only ordinary versioned state and rebinding prevents the same wrong-target trace without a lineage-bound single-use execution capability.","method":"Replay the identical handoff trace against a baseline that has typed IDs, versioned state, and handoff rebinding but no approval-lineage-bound capability.","status":"survived","source_refs":["synthetic://replay-results/baseline-target-binding-l4-001"]},{"falsifier_id":"KILL-SYN-002","statement":"Published prior art already discloses an equivalent or broader mechanism for version-bound physical-target-to-native-handle authorization continuity.","method":"Run the public-only Systematic Invention Research workflow across patents, standards, papers, and public repositories using alternate terminology and classification/citation paths.","status":"open","source_refs":[]}],"prior_art_challenge":{"workflow_ref":"repo:docs/systematic-invention-research-stack.md","status":"pending","coverage_refs":[],"strongest_counterevidence":"Not yet established; the candidate must not advance beyond prior-art pending on synthetic product evidence alone.","conclusion":"not_run"},"status":"prior_art_pending","decision":"needs_more_evidence","rationale":"The synthetic hard case and mechanism/control kill test are strong enough to justify public prior-art research, but no novelty or patentability conclusion is supported.","next_falsification_step":"Run a bounded prior-art challenge and search for equivalent controls before retaining this as a patent-research candidate."}],"evidence":{"claims":[{"statement":"The synthetic replay preserves a stale approved binding across node handoff and demonstrates a wrong-target path in the unguarded baseline.","evidence_status":"OBSERVED","source_refs":["synthetic://replay-results/baseline-target-binding-l4-001"]},{"statement":"Binding approval lineage and binding version to a single-use effect-boundary capability is a reusable mechanism candidate rather than merely a UI warning.","evidence_status":"DERIVED","source_refs":["synthetic://replay-fixtures/target-binding-l4-001"]}],"unknowns":[{"statement":"The closest published mechanisms and patent-family coverage are not yet established.","evidence_status":"UNKNOWN","source_refs":[]}]},"simulation_status":"synthetic_reference"}